{
  "$schema": "https://thekingdom.dev/schemas/string-crawl-strand-lab/0.1.json",
  "protocol": "kingdom.string-crawl-strand-lab/0.1",
  "lab_id": "string-crawl-strand-lab-02-2026-08-16",
  "version": "0.1.0",
  "title": "STRAND Lab 02: Release Cospans & the χ=1 Impostor",
  "mode": "SYNTHETIC_OFFLINE_EXACT",
  "predecessor": {
    "protocol": "kingdom.string-crawl-trace-sheet-lab/0.1",
    "lab_id": "string-crawl-trace-sheet-lab-2026-08-16",
    "url": "https://thekingdom.dev/labs/string-crawl-trace-sheet-lab-2026-08-16.json",
    "schema_url": "https://thekingdom.dev/schemas/string-crawl-trace-sheet-lab/0.1.json",
    "guide_url": "https://thekingdom.dev/STRING-CRAWL-TRACE-SHEET-LAB.md",
    "git_commit": "57f1f8a1d018d5128501b82c5ddde1976677b3a1",
    "semantic_digest": "sha256:c3f86b0203b895da56092c598113046f0dab8a4f25b41314c3d4329474d4e16f",
    "byte_sha256": "sha256:2e559164df6985776a4641b60c846a0403f14df30c84648b72c095642df6e051",
    "schema_byte_sha256": "sha256:c4e69a61994831574fe706d464852b164c65b6d177c5680dc9b0278bcb446268",
    "guide_byte_sha256": "sha256:5f5fb893a31d1c7e02aca63401c002ae601bee6653d41adc6617bb909732e8e3",
    "relation": "IMMUTABLE_LAB_01_PREDECESSOR",
    "mutates_predecessor": false,
    "imports_authority": false
  },
  "source_binding": {
    "protocol": "kingdom.explore-phenomena-deep-project/0.1",
    "project_id": "string-crawl-trace-sheet-2026-08-15",
    "git_commit": "a3a5ab28a058953f577576d0e1be3dd7beab046d",
    "locator": "data/exploration/string-crawl-trace-sheet.v0.1.json",
    "semantic_digest": "sha256:bf7ae379612ab96d08742a0070cbea0ce971977f71fec22699c4b0307d321305",
    "raw_sha256": "sha256:4afc5f15c258a0ac4274889783bd2d91445950c92103c60442ed9ed89d1fdc72",
    "relation": "BOUNDED_SYNTHETIC_FALSIFIER_FIXTURE",
    "mutates_source": false,
    "imports_authority": false
  },
  "conventions": {
    "coefficient_field": "F2",
    "cell_model": "FINITE_REGULAR_CW_FIXTURE",
    "occurrence_identity_retained": true,
    "route_labels_identify_occurrences": false,
    "alignment_requires_explicit_edge": true,
    "face_requires_explicit_attaching_cycle": true,
    "orientations_used_for_f2_rank": false,
    "empty_face_frontier": true
  },
  "release_slices": [
    { "id": "r0", "order": 0, "label": "synthetic-release-zero" },
    { "id": "r1", "order": 1, "label": "synthetic-release-one" },
    { "id": "r2", "order": 2, "label": "synthetic-release-two" }
  ],
  "tracked_routes": [
    { "route_id": "route-home", "thread": "stable", "present_in": ["r0", "r1", "r2"], "born_in": null },
    { "route_id": "route-map", "thread": "stable", "present_in": ["r0", "r1", "r2"], "born_in": null },
    { "route_id": "route-commons", "thread": "stable", "present_in": ["r0", "r1", "r2"], "born_in": null },
    { "route_id": "route-rights", "thread": "stable", "present_in": ["r0", "r1", "r2"], "born_in": null },
    { "route_id": "route-contact", "thread": "stable", "present_in": ["r0", "r1", "r2"], "born_in": null },
    { "route_id": "route-lab", "thread": "born", "present_in": ["r1", "r2"], "born_in": "r1" }
  ],
  "vertices": [
    { "id": "v-r0-home", "slice_id": "r0", "kind": "TRACKED_ROUTE_OCCURRENCE", "route_id": "route-home", "redirect_target_label": null },
    { "id": "v-r0-map", "slice_id": "r0", "kind": "TRACKED_ROUTE_OCCURRENCE", "route_id": "route-map", "redirect_target_label": null },
    { "id": "v-r0-commons", "slice_id": "r0", "kind": "TRACKED_ROUTE_OCCURRENCE", "route_id": "route-commons", "redirect_target_label": null },
    { "id": "v-r0-rights", "slice_id": "r0", "kind": "TRACKED_ROUTE_OCCURRENCE", "route_id": "route-rights", "redirect_target_label": null },
    { "id": "v-r0-contact", "slice_id": "r0", "kind": "TRACKED_ROUTE_OCCURRENCE", "route_id": "route-contact", "redirect_target_label": null },
    { "id": "v-r1-home", "slice_id": "r1", "kind": "TRACKED_ROUTE_OCCURRENCE", "route_id": "route-home", "redirect_target_label": null },
    { "id": "v-r1-map", "slice_id": "r1", "kind": "TRACKED_ROUTE_OCCURRENCE", "route_id": "route-map", "redirect_target_label": null },
    { "id": "v-r1-commons", "slice_id": "r1", "kind": "TRACKED_ROUTE_OCCURRENCE", "route_id": "route-commons", "redirect_target_label": null },
    { "id": "v-r1-rights", "slice_id": "r1", "kind": "TRACKED_ROUTE_OCCURRENCE", "route_id": "route-rights", "redirect_target_label": null },
    { "id": "v-r1-contact", "slice_id": "r1", "kind": "TRACKED_ROUTE_OCCURRENCE", "route_id": "route-contact", "redirect_target_label": null },
    { "id": "v-r1-lab", "slice_id": "r1", "kind": "TRACKED_ROUTE_OCCURRENCE", "route_id": "route-lab", "redirect_target_label": null },
    { "id": "v-r2-home", "slice_id": "r2", "kind": "TRACKED_ROUTE_OCCURRENCE", "route_id": "route-home", "redirect_target_label": null },
    { "id": "v-r2-map", "slice_id": "r2", "kind": "TRACKED_ROUTE_OCCURRENCE", "route_id": "route-map", "redirect_target_label": null },
    { "id": "v-r2-commons", "slice_id": "r2", "kind": "TRACKED_ROUTE_OCCURRENCE", "route_id": "route-commons", "redirect_target_label": null },
    { "id": "v-r2-rights", "slice_id": "r2", "kind": "TRACKED_ROUTE_OCCURRENCE", "route_id": "route-rights", "redirect_target_label": null },
    { "id": "v-r2-contact", "slice_id": "r2", "kind": "TRACKED_ROUTE_OCCURRENCE", "route_id": "route-contact", "redirect_target_label": null },
    { "id": "v-r2-lab", "slice_id": "r2", "kind": "TRACKED_ROUTE_OCCURRENCE", "route_id": "route-lab", "redirect_target_label": null },
    { "id": "v-r2-redirect-target", "slice_id": "r2", "kind": "REDIRECT_TARGET_ONLY", "route_id": null, "redirect_target_label": "synthetic-legacy-target" }
  ],
  "edges": [
    { "id": "e-r0-home-map", "kind": "PATH", "from": "v-r0-home", "to": "v-r0-map", "slice_id": "r0", "between_slices": [], "route_id": null, "face_ids": ["f-r0-r1-home-map"] },
    { "id": "e-r0-map-commons", "kind": "PATH", "from": "v-r0-map", "to": "v-r0-commons", "slice_id": "r0", "between_slices": [], "route_id": null, "face_ids": ["f-r0-r1-map-commons"] },
    { "id": "e-r0-commons-rights", "kind": "PATH", "from": "v-r0-commons", "to": "v-r0-rights", "slice_id": "r0", "between_slices": [], "route_id": null, "face_ids": ["f-r0-r1-commons-rights"] },
    { "id": "e-r0-rights-contact", "kind": "PATH", "from": "v-r0-rights", "to": "v-r0-contact", "slice_id": "r0", "between_slices": [], "route_id": null, "face_ids": ["f-r0-r1-rights-contact"] },
    { "id": "e-r1-home-map", "kind": "PATH", "from": "v-r1-home", "to": "v-r1-map", "slice_id": "r1", "between_slices": [], "route_id": null, "face_ids": ["f-r0-r1-home-map", "f-r1-r2-home-map"] },
    { "id": "e-r1-map-commons", "kind": "PATH", "from": "v-r1-map", "to": "v-r1-commons", "slice_id": "r1", "between_slices": [], "route_id": null, "face_ids": ["f-r0-r1-map-commons", "f-r1-r2-map-commons"] },
    { "id": "e-r1-commons-rights", "kind": "PATH", "from": "v-r1-commons", "to": "v-r1-rights", "slice_id": "r1", "between_slices": [], "route_id": null, "face_ids": ["f-r0-r1-commons-rights", "f-r1-r2-commons-rights"] },
    { "id": "e-r1-rights-contact", "kind": "PATH", "from": "v-r1-rights", "to": "v-r1-contact", "slice_id": "r1", "between_slices": [], "route_id": null, "face_ids": ["f-r0-r1-rights-contact", "f-r1-r2-rights-contact"] },
    { "id": "e-r1-commons-lab", "kind": "PATH", "from": "v-r1-commons", "to": "v-r1-lab", "slice_id": "r1", "between_slices": [], "route_id": null, "face_ids": ["f-r1-r2-commons-lab"] },
    { "id": "e-r2-home-map", "kind": "PATH", "from": "v-r2-home", "to": "v-r2-map", "slice_id": "r2", "between_slices": [], "route_id": null, "face_ids": ["f-r1-r2-home-map"] },
    { "id": "e-r2-map-commons", "kind": "PATH", "from": "v-r2-map", "to": "v-r2-commons", "slice_id": "r2", "between_slices": [], "route_id": null, "face_ids": ["f-r1-r2-map-commons"] },
    { "id": "e-r2-commons-rights", "kind": "PATH", "from": "v-r2-commons", "to": "v-r2-rights", "slice_id": "r2", "between_slices": [], "route_id": null, "face_ids": ["f-r1-r2-commons-rights"] },
    { "id": "e-r2-rights-contact", "kind": "PATH", "from": "v-r2-rights", "to": "v-r2-contact", "slice_id": "r2", "between_slices": [], "route_id": null, "face_ids": ["f-r1-r2-rights-contact"] },
    { "id": "e-r2-commons-lab", "kind": "PATH", "from": "v-r2-commons", "to": "v-r2-lab", "slice_id": "r2", "between_slices": [], "route_id": null, "face_ids": ["f-r1-r2-commons-lab"] },
    { "id": "e-home-r0-r1", "kind": "ALIGNMENT", "from": "v-r0-home", "to": "v-r1-home", "slice_id": null, "between_slices": ["r0", "r1"], "route_id": "route-home", "face_ids": ["f-r0-r1-home-map"] },
    { "id": "e-map-r0-r1", "kind": "ALIGNMENT", "from": "v-r0-map", "to": "v-r1-map", "slice_id": null, "between_slices": ["r0", "r1"], "route_id": "route-map", "face_ids": ["f-r0-r1-home-map", "f-r0-r1-map-commons"] },
    { "id": "e-commons-r0-r1", "kind": "ALIGNMENT", "from": "v-r0-commons", "to": "v-r1-commons", "slice_id": null, "between_slices": ["r0", "r1"], "route_id": "route-commons", "face_ids": ["f-r0-r1-map-commons", "f-r0-r1-commons-rights"] },
    { "id": "e-rights-r0-r1", "kind": "ALIGNMENT", "from": "v-r0-rights", "to": "v-r1-rights", "slice_id": null, "between_slices": ["r0", "r1"], "route_id": "route-rights", "face_ids": ["f-r0-r1-commons-rights", "f-r0-r1-rights-contact"] },
    { "id": "e-contact-r0-r1", "kind": "ALIGNMENT", "from": "v-r0-contact", "to": "v-r1-contact", "slice_id": null, "between_slices": ["r0", "r1"], "route_id": "route-contact", "face_ids": ["f-r0-r1-rights-contact"] },
    { "id": "e-home-r1-r2", "kind": "ALIGNMENT", "from": "v-r1-home", "to": "v-r2-home", "slice_id": null, "between_slices": ["r1", "r2"], "route_id": "route-home", "face_ids": ["f-r1-r2-home-map"] },
    { "id": "e-map-r1-r2", "kind": "ALIGNMENT", "from": "v-r1-map", "to": "v-r2-map", "slice_id": null, "between_slices": ["r1", "r2"], "route_id": "route-map", "face_ids": ["f-r1-r2-home-map", "f-r1-r2-map-commons"] },